{
  "specVersion": "1.0.0",
  "id": "urn:pactspec:pactspec:paid-summarize-demo",
  "name": "Paid Summarize Demo",
  "version": "1.0.0",
  "description": "A paid text summarization agent that demonstrates the x402 payment flow. Identical to the free summarize agent but requires a USDC micro-payment per invocation via the HTTP 402 protocol.",
  "provider": {
    "name": "PactSpec",
    "url": "https://pactspec.dev",
    "contact": "hello@pactspec.dev"
  },
  "endpoint": {
    "url": "https://pactspec.dev/api/demo/paid-summarize",
    "auth": { "type": "none" }
  },
  "skills": [
    {
      "id": "paid-summarize",
      "name": "Paid Summarize Text",
      "description": "Condenses a passage of text into a short summary. Requires x402 payment (0.001 USDC on Base) before the summary is returned. Without payment proof the endpoint returns an HTTP 402 challenge.",
      "tags": ["nlp", "summarization", "text", "claude", "x402", "paid"],
      "inputSchema": {
        "type": "object",
        "required": ["text"],
        "properties": {
          "text": {
            "type": "string",
            "minLength": 1,
            "maxLength": 8000,
            "description": "The text to summarize"
          },
          "maxSentences": {
            "type": "integer",
            "minimum": 1,
            "maximum": 10,
            "description": "Number of sentences in the summary. Defaults to 3."
          }
        }
      },
      "outputSchema": {
        "type": "object",
        "required": ["summary", "sentences", "paid", "paymentId"],
        "properties": {
          "summary": {
            "type": "string",
            "description": "The generated summary"
          },
          "sentences": {
            "type": "integer",
            "description": "Number of sentences in the returned summary"
          },
          "paid": {
            "type": "boolean",
            "description": "Whether this response was served after a verified payment"
          },
          "paymentId": {
            "type": "string",
            "description": "Unique ID for the processed payment"
          }
        }
      },
      "pricing": {
        "model": "per-invocation",
        "amount": 0.001,
        "currency": "USDC",
        "protocol": "x402"
      },
      "testSuite": {
        "url": "https://pactspec.dev/test-suites/paid-summarize.json",
        "type": "http-roundtrip"
      },
      "examples": [
        {
          "description": "Request without payment returns 402 challenge",
          "input": {
            "text": "The James Webb Space Telescope is a space telescope designed to conduct infrared astronomy.",
            "maxSentences": 2
          },
          "expectedOutput": {
            "type": "x402-payment-required",
            "amount": "0.001",
            "currency": "USDC",
            "network": "base"
          }
        },
        {
          "description": "Request with payment proof returns summary",
          "input": {
            "text": "The James Webb Space Telescope is a space telescope designed to conduct infrared astronomy.",
            "maxSentences": 2
          },
          "expectedOutput": {
            "summary": "The James Webb Space Telescope conducts infrared astronomy. It observes objects too distant or faint for Hubble.",
            "sentences": 2,
            "paid": true,
            "paymentId": "example-payment-id"
          }
        }
      ]
    }
  ],
  "tags": ["nlp", "summarization", "ai", "claude", "x402", "paid", "demo"],
  "license": "MIT"
}
